{"profile_version":1,"target_contract":"session_catalog_v1","current_contract_version":1,"peer_contract_version":1,"classification":"capability_degradation","available_capabilities":["session.observe"],"unavailable_capabilities":["session.catalog.v1"],"safe_effect":"directory_unavailable_without_synthetic_sessions"}
